created_at;id_str;full_text;quote_count;reply_count;retweet_count;favorite_count;lang;user_id_str;conversation_id_str;username;tweet_url
Wed Nov 15 02:28:21 +0000 2023;1724615291504853410;"can yall believe coldplay is having concert here in indonesia TODAY. which is WEDNESDAY😪😪";0;1;0;1;en;1546522153188982784;1724615291504853410;youn9royals;https://twitter.com/youn9royals/status/1724615291504853410
Wed Nov 15 02:26:58 +0000 2023;1724614939825123540;"my manager suddenly took sick leave today... is he going to coldplay concert or what";0;1;0;0;en;1534828781507969024;1724614939825123540;saca311;https://twitter.com/saca311/status/1724614939825123540
Wed Nov 15 02:24:07 +0000 2023;1724614223345717592;"WTB Coldplay MOTS in Jakarta, Seating Tickets Category 3/4/5/6 butuh 2-5 tickets if available for COD  tags  wts wtb sell buy jual beli tiket konser concert coldplay jakarta";0;6;0;1;en;1133260035876839424;1724614223345717592;bangyedamf;https://twitter.com/bangyedamf/status/1724614223345717592
Wed Nov 15 02:21:02 +0000 2023;1724613448318029878;"And just like that, coldplay concert next weeeeeeeek😳";0;0;0;0;en;373490545;1724613448318029878;atiraaar;https://twitter.com/atiraaar/status/1724613448318029878
Wed Nov 15 02:15:06 +0000 2023;1724611954965401781;"WTB COLDPLAY CONCERT, 4 TIX FESTIVAL/ CAT 2 / CAT 3. DM YAAA";0;3;0;0;en;1420974650851434497;1724611954965401781;zhrsalsabila_;https://twitter.com/zhrsalsabila_/status/1724611954965401781
Wed Nov 15 02:08:42 +0000 2023;1724610346105847927;"WELCOME TO INDONESIA! THANK YOU FOR COMING! I hope you can enjoy the moments here, I wish I could come to your concert 😭 But, can you say AKU PADAMU (I love you) to the audience? 💜💜💜💜💜💜💜💜💜 @coldplay";0;0;0;0;en;191826228;1724610346105847927;Miss_Bindi;https://twitter.com/Miss_Bindi/status/1724610346105847927
Wed Nov 15 02:06:38 +0000 2023;1724609822543507926;"Happy Coldplay day to everyone who'll attend the concert today! Have the best time 🥳🥳🥳🫶🏻🫶🏻🫶🏻";0;0;41;22;en;188254319;1724609822543507926;teppy87;https://twitter.com/teppy87/status/1724609822543507926
Wed Nov 15 01:53:11 +0000 2023;1724606441422475721;"i feel like a coldplay concert would have the same vibes as a hip christian church where they sing and have strobe lights";0;0;0;1;en;2770446821;1724606441422475721;maddiedris;https://twitter.com/maddiedris/status/1724606441422475721
Wed Nov 15 01:51:43 +0000 2023;1724606068628836743;"@kookoorobun Fix they are going to coldplay concert wkwkkw";0;0;0;0;en;1574590224918663168;1724604720097247510;sevenletgo;https://twitter.com/sevenletgo/status/1724606068628836743
Wed Nov 15 01:51:41 +0000 2023;1724606061515358601;"Please dont do this. People are going there to enjoy Coldplay’s concert not to wave flags. Respect the artist and respect others.";0;1;0;8;en;1293630180456460288;1724606061515358601;icherryeol61;https://twitter.com/icherryeol61/status/1724606061515358601
Wed Nov 15 01:41:44 +0000 2023;1724603558845399063;"LF PASSENGERS ‼️ COLDPLAY CARPOOL  AVAILABLE PICK-UP/DROP-OFF: Batasan, Don Antonio, Circle, Centris, Cubao, SM North, Marikina, BGC, and MOA  ⛓️ coldplay music of the spheres concert carpool shuttle vanpool ph philippines bulacan  11.15";0;0;0;0;en;2758413904;1724603558845399063;hartxlsx;https://twitter.com/hartxlsx/status/1724603558845399063
Wed Nov 15 01:33:20 +0000 2023;1724601443343278227;"people going to coldplay concerts, and i'm going to fallen leaves screening for the better yearning experience yupp!!";0;0;0;0;en;1243127420917432321;1724601443343278227;Finchering;https://twitter.com/Finchering/status/1724601443343278227
Wed Nov 15 01:32:25 +0000 2023;1724601214162145707;"Coldplay Concert India 2024 Tickets Price, Booking, Dates for Asia Tour https://t.co/whCmHoWaxU";0;0;0;0;en;1715642958228189184;1724601214162145707;Sarkarijob42166;https://twitter.com/Sarkarijob42166/status/1724601214162145707
Wed Nov 15 01:31:16 +0000 2023;1724600925191565521;"Coldplay concert tonight, if you love yourself avoid GBK from 2pm... and better use MRT or TJ, not Gojek or Grab.";0;0;0;0;en;91082920;1724600925191565521;bleudomino;https://twitter.com/bleudomino/status/1724600925191565521
Wed Nov 15 01:29:23 +0000 2023;1724600451276976584;"Artist with the most concerts in a single tour at Wembley Stadium:  #1. Taylor Swift — 8 shows #2. Coldplay / Harry Styles — 6 shows #3. Ed Sheeran — 5 Shows https://t.co/8ZrkT0eeEe";9;4;53;551;en;424299528;1724600451276976584;TaylorSwiftChar;https://twitter.com/TaylorSwiftChar/status/1724600451276976584
Wed Nov 15 01:11:45 +0000 2023;1724596012097138777;"WTB want to buy coldplay in jakarta cat 5/6/7/8 • cod venue HMU on DM   🏷️ coldplay jakarta wts wtb ticket concert";0;5;0;3;en;1398225704135786503;1724596012097138777;yoursoreo;https://twitter.com/yoursoreo/status/1724596012097138777
Wed Nov 15 01:02:01 +0000 2023;1724593561273090393;"It's @coldplay day!! Can't watch the concert in Jakarta but still in the mood to listen to their songs in #Spotifyplaylist 😊.  https://t.co/hlUVzzF4ZT  🎶 Cause you're a sky, cause you're a sky..full of stars 🎶  #ColdplayJakarta #ColdplayInJakarta";0;0;0;1;en;1214465101614370817;1724593561273090393;vinaverdemusic;https://twitter.com/vinaverdemusic/status/1724593561273090393
Wed Nov 15 00:42:49 +0000 2023;1724588729225064590;"@coldplay Have fun everyone hope everything is under control and enjoy the concert for all";0;0;0;1;en;1476001493278871556;1724583392908353636;jiniyaigoya;https://twitter.com/jiniyaigoya/status/1724588729225064590
Wed Nov 15 00:26:19 +0000 2023;1724584578025935298;"LBA 1 Premium | Coldplay concert jan19, 2024 cutie ♥";0;0;0;0;en;736012456825212929;1724584578025935298;Lextinctguy;https://twitter.com/Lextinctguy/status/1724584578025935298
Wed Nov 15 00:26:01 +0000 2023;1724584502238859379;"@coldplay Please release a concert of your tour on Blue Ray or on some platform please, I only got to see you in the cinema and that was over a year ago. 😭✨";0;0;0;1;en;1511578058708426753;1724583392908353636;gab_hobii13;https://twitter.com/gab_hobii13/status/1724584502238859379
Wed Nov 15 00:25:30 +0000 2023;1724584374170243457;"@coldplay Will be the best concert ever in 🇮🇩";0;0;0;1;en;33156941;1724583392908353636;MercyOktyasari;https://twitter.com/MercyOktyasari/status/1724584374170243457
Wed Nov 15 00:23:11 +0000 2023;1724583789215756681;"Police Announce Traffic Diversion to Anticipate Coldplay Concert https://t.co/mDTRvMPxFW #TempoEnglish";0;0;0;0;en;412819445;1724583789215756681;tempo_english;https://twitter.com/tempo_english/status/1724583789215756681
Wed Nov 15 00:23:07 +0000 2023;1724583773638111710;"Conservative Muslims protest Coldplay’s planned concert in Indonesia over the band’s LGBTQ+ support  #ColdplayJakarta  https://t.co/4LqWagNtn9";0;0;0;0;en;2792419310;1724583773638111710;agus_atra;https://twitter.com/agus_atra/status/1724583773638111710
Wed Nov 15 00:18:31 +0000 2023;1724582615209120174;"WTB !!!  COLDPLAY Music of spheres concert in KUALA LUMPUR   need 1ticket cat6 section 314-317  please dm me if u have any..  #WTB #COLDPLAYinKL #ColdplayinMY";0;1;2;1;en;1428903683224264705;1724582615209120174;hsyoung88_;https://twitter.com/hsyoung88_/status/1724582615209120174
Wed Nov 15 00:11:15 +0000 2023;1724580786551345471;"i am taking chanyeol (in a form of photocard lol) to coldplay concert today!🥹🤍";0;0;0;3;en;1612690915717689345;1724580786551345471;loeyofmalife;https://twitter.com/loeyofmalife/status/1724580786551345471
Wed Nov 15 00:02:56 +0000 2023;1724578694264770566;"WTS want to sell Coldplay Concert in Singapore  🗓️31 January 2024 🎫2tix Cat 7 sec 614 row J 💵original price (negotiable) 📍COD denpasar/jakarta/bintaro 🏦accept indonesian bank transfer only  all proof by dm 📩 https://t.co/TWk9yeIzHB";0;8;3;3;en;1022290371630362624;1724578694264770566;beur9ine;https://twitter.com/beur9ine/status/1724578694264770566
Tue Nov 14 23:55:30 +0000 2023;1724576825383473434;"Have fun everyone at @coldplay concert 😁😁";0;0;0;0;en;1630758398;1724576825383473434;nomiaill;https://twitter.com/nomiaill/status/1724576825383473434
Tue Nov 14 23:52:46 +0000 2023;1724576137450570039;"may everyone that is going to coldplay's concert today will have the best times of their lives";0;0;0;0;en;1184101332;1724576137450570039;jerlehaggard;https://twitter.com/jerlehaggard/status/1724576137450570039
Tue Nov 14 23:46:08 +0000 2023;1724574465831440739;"@FionaSDaly To book a room for a Coldplay Concert will cost you €18 000.";0;1;0;0;en;20926516;1724500745905394169;blondieone1;https://twitter.com/blondieone1/status/1724574465831440739
Tue Nov 14 23:38:27 +0000 2023;1724572532638929317;"catching up on bangtan content and i am full on sobbing at the behind vid of jin performing the astronaut at coldplay’s concert. bring him back to me rn";0;0;0;0;en;2519167745;1724572532638929317;ghostinkoo;https://twitter.com/ghostinkoo/status/1724572532638929317
Tue Nov 14 23:37:04 +0000 2023;1724572185401200720;"@deadseriouslike @Maraxis3 @everhero13 @tis_sjoberg Well yes but I think timing’s of the essence here… unfortunately her time in Asia / Oceania clashes with Indonesia’s pemilu so tensions will definitely be high around that time. Also, Coldplay’s concert is literally being protested by #those people rn… imagine her with YNTCD 💀";0;0;0;3;en;1354848865086660610;1724357688128368683;PlNKAVENUE;https://twitter.com/PlNKAVENUE/status/1724572185401200720
Tue Nov 14 23:27:09 +0000 2023;1724569690943697037;"My colleagues (and bosses!) got a bunch of free Coldplay tickets last minute and we’re all supposedly gonna be in the same zone, standing lol  Gonna be interesting to see all of us out of the hospital, AT A CONCERT, vibin’ together 😂";0;1;0;3;en;268316443;1724569690943697037;zafirazafrin;https://twitter.com/zafirazafrin/status/1724569690943697037
Tue Nov 14 23:24:01 +0000 2023;1724568899956715834;"@GloucesterPark just wondering if the track is open for parking this Sunday for the Coldplay concert?";0;0;0;0;en;313724107;1724568899956715834;kicyoass;https://twitter.com/kicyoass/status/1724568899956715834
Tue Nov 14 23:15:39 +0000 2023;1724566795791860167;"coldplay concert is one of my wishlist in lifetime for a long time      AAAAAAAAAAAAAAA      https://t.co/lgAVnOGzIo";0;0;0;0;en;871251808840171520;1724566154260484113;aslanjcallen;https://twitter.com/aslanjcallen/status/1724566795791860167
Tue Nov 14 23:13:06 +0000 2023;1724566154260484113;"TODAY COLDPLAY HOLD THEIR CONCERT IN MY CITY AND I CANT ATTEND IT WAWAAAAAAAAAAAAAAAGGGGGGHJJHHHHHJJJJH https://t.co/fwlm9jsJgE";0;1;0;0;en;871251808840171520;1724566154260484113;aslanjcallen;https://twitter.com/aslanjcallen/status/1724566154260484113
Tue Nov 14 22:46:16 +0000 2023;1724559401795698786;"Coldplay Concert India 2024 Tickets Price, Booking, Dates for Asia Tour https://t.co/F4Z7W0nyPv";0;0;0;0;en;1715642958228189184;1724559401795698786;Sarkarijob42166;https://twitter.com/Sarkarijob42166/status/1724559401795698786
Tue Nov 14 22:45:45 +0000 2023;1724559270325223786;"@softtail65 I only knew one Coldplay song when I went to see them in concert, and I absolutely fell in love with them at that concert.";0;1;0;2;en;1337825566502903808;1724532664315809949;RBlooms2021;https://twitter.com/RBlooms2021/status/1724559270325223786
Tue Nov 14 22:34:26 +0000 2023;1724556424389534092;"@calvinXIII 😅 next week coldplay concert fr your outfit";0;1;0;1;en;1489067052132286464;1724556424389534092;kennyboyyy95;https://twitter.com/kennyboyyy95/status/1724556424389534092
Tue Nov 14 22:06:35 +0000 2023;1724549413115236754;"@diorsymn Then I d1e OR  wife u up so u can take me to another Coldplay concert and manifest Jin is there😔";0;0;0;0;en;1434101183807959042;1724544690492416484;Yoong1ssimp7;https://twitter.com/Yoong1ssimp7/status/1724549413115236754
Tue Nov 14 21:49:58 +0000 2023;1724545233294172351;"Coldplay Concert India 2024 Tickets Price, Booking, Dates for Asia Tour https://t.co/oZacCvIJvl";0;0;0;0;en;1715642958228189184;1724545233294172351;Sarkarijob42166;https://twitter.com/Sarkarijob42166/status/1724545233294172351
Tue Nov 14 21:47:48 +0000 2023;1724544688869560818;"Those who refuse Coldplay concerts in Indonesia will definitely not accept this.";0;0;0;1;en;1539031206075199488;1724544688869560818;Ahoy1983;https://twitter.com/Ahoy1983/status/1724544688869560818
Tue Nov 14 21:19:55 +0000 2023;1724537669588517165;"The worst experiences today with @VirginAustralia , who changed our flight in lest than 6 hours due to “downside of the plane” in a peak week with Coldplay concerts and having tickets 6 months in advance.";0;1;0;0;en;40075002;1724537669588517165;helfa31;https://twitter.com/helfa31/status/1724537669588517165
Tue Nov 14 20:58:19 +0000 2023;1724532233657053337;"I would absolutely love to go to a Coldplay concert, are you kidding me";0;1;0;0;en;101184487;1724532233657053337;AskAboutMala;https://twitter.com/AskAboutMala/status/1724532233657053337
Tue Nov 14 20:45:58 +0000 2023;1724529124297830776;"@coldplaysunset That people doesn't like coldplay. They just listen to viva la vida and go to the concerts... but a real coldplay like him that basically just lives posting photos and threads about the band and still votes bolsonaro is kinda sad";0;0;0;1;en;528820240;1724469544591225133;s_p_i_e_s;https://twitter.com/s_p_i_e_s/status/1724529124297830776
Tue Nov 14 20:35:40 +0000 2023;1724526535376564676;"OK I NEED TO SLEEP, I have seminar at 7 and a coldplay concert tonite";0;0;0;0;en;1570657808122793986;1724526535376564676;porodil19;https://twitter.com/porodil19/status/1724526535376564676
Tue Nov 14 19:50:49 +0000 2023;1724515248386805940;"Coldplay Concert India 2024 Tickets Price, Booking, Dates for Asia Tour https://t.co/ZKYGg1aGhM";0;0;0;0;en;1715642958228189184;1724515248386805940;Sarkarijob42166;https://twitter.com/Sarkarijob42166/status/1724515248386805940
Tue Nov 14 19:30:42 +0000 2023;1724510184167363031;"@breakfasttv Coldplay. Best energy from any concert I've been to";0;0;0;0;en;1353829583544578048;1724459814825136523;shouldbehiking;https://twitter.com/shouldbehiking/status/1724510184167363031
Tue Nov 14 19:28:40 +0000 2023;1724509674689413565;"@LimitBuyer @Enezator Me too, or even a Coldplay concert 😁";0;0;0;0;en;942578286772842496;1724181379326316789;TheEverglowlife;https://twitter.com/TheEverglowlife/status/1724509674689413565
Tue Nov 14 19:19:21 +0000 2023;1724507326852239553;"Coldplay Concert India 2024 Tickets Price, Booking, Dates for Asia Tour https://t.co/s2d9ur1YJw";0;0;0;0;en;1715642958228189184;1724507326852239553;Sarkarijob42166;https://twitter.com/Sarkarijob42166/status/1724507326852239553
Tue Nov 14 19:07:06 +0000 2023;1724504244781187205;"I am also watching a Coldplay concert video  Night made!";0;0;0;2;en;1368769242955460611;1724501363843826064;thatchilledbabe;https://twitter.com/thatchilledbabe/status/1724504244781187205
Tue Nov 14 18:51:40 +0000 2023;1724500359991935144;"Ahhhh Chrisssss.. welcome to Indonesia Chrissss @coldplay ! I forgot tomorrow's Coldplay concert 🥹😭😭😭 cryingggg😭.. plissss come back again until i watch u guysss. I hv tried everything but i had too much competition just to watch u guys.  never mind Indonesia, Thailand,..";0;1;0;0;en;182286623;1724500359991935144;Reginaghie;https://twitter.com/Reginaghie/status/1724500359991935144
Tue Nov 14 18:47:56 +0000 2023;1724499421486882915;"Coldplay Concert India 2024 Tickets Price, Booking, Dates for Asia Tour https://t.co/15GSEHujUE";0;0;0;0;en;1715642958228189184;1724499421486882915;Sarkarijob42166;https://twitter.com/Sarkarijob42166/status/1724499421486882915
Tue Nov 14 18:14:28 +0000 2023;1724491000821756217;"This crowd is whiter than a Coldplay concert.";0;2;0;0;en;2819926751;1724491000821756217;crawlings13;https://twitter.com/crawlings13/status/1724491000821756217
Tue Nov 14 18:04:22 +0000 2023;1724488459027661119;"COLDPLAY Music Of The Spheres World Tour DAY 2 - Jan 20, 2024  P11,000 each (same price)  Lowerbox B Regular 2 Section 220, Row 52 - 4 adjacent seats ✅ meetup  rfs: nadoble nang bili  🏷️ wts lfb lbb lbox reg coldplay manila bulacan ph arena concert ticket tix #coldplay #MOTSWT https://t.co/K6P4rS0XWP";0;1;0;2;en;1112386197815386113;1724488459027661119;twicewaves;https://twitter.com/twicewaves/status/1724488459027661119
Tue Nov 14 17:50:13 +0000 2023;1724484895597318650;"@KNOWLESROLLS2 @fadgaeatshit132 @bemaroon97 @samfromthevault Go ask @dfallaccess since all concert at Mâs Monumental including Madonna, AC/DC, Harry Styles, Coldplay and The Weeknd has empty seat at that section. Doesn't matter since Taylor still sold more tickets than any other artist in that stadium for a single day. https://t.co/hpQKIUn0pG";0;0;0;0;en;1103285407901339650;1724359503481540877;missamericana96;https://twitter.com/missamericana96/status/1724484895597318650
Tue Nov 14 17:41:41 +0000 2023;1724482749946610132;"life before coldplay concert in jakarta: https://t.co/eHrwI7BtNN";0;1;0;1;en;1692859317991755776;1724482749946610132;fadhlurrohhman;https://twitter.com/fadhlurrohhman/status/1724482749946610132
Tue Nov 14 17:27:48 +0000 2023;1724479254216229337;"bru all my friends goin 2 coldplay concert";0;0;0;0;en;1498922781991337985;1724479254216229337;pinkmat3r;https://twitter.com/pinkmat3r/status/1724479254216229337
Tue Nov 14 17:26:30 +0000 2023;1724478927157231876;"I'm not going to open any social media tomorrow just to see people's watching Coldplay concert which is just a few kilometers from me while i have to go to work because i didn't get the tix. I HATE YOU ALL, IT SHOULD BE ME TF.";0;0;0;0;en;517504415;1724478927157231876;prevshinyako;https://twitter.com/prevshinyako/status/1724478927157231876
Tue Nov 14 17:15:51 +0000 2023;1724476246543733069;"It has been reported that Croke Park is set to host a sixth concert next year, with legendary rock band AC/DC being rumoured to headline the show.  If confirmed, the band would join Bruce Springsteen and Coldplay at the Dublin stadium in 2024.  https://t.co/UgNVEiozwK";0;0;0;1;en;2697780283;1724476246543733069;Lovindotie;https://twitter.com/Lovindotie/status/1724476246543733069
Tue Nov 14 17:15:02 +0000 2023;1724476041035751664;"hopefully yall who go to Coldplay concert in Jakarta will do this. I heard Amnesty Indonesia will be there too. so its the right time";0;0;1;1;en;383091887;1724476041035751664;megalod0n___;https://twitter.com/megalod0n___/status/1724476041035751664
Tue Nov 14 17:14:36 +0000 2023;1724475934210670991;"It has been reported that Croke Park is set to host a sixth concert next year, with legendary rock band AC/DC being rumoured to headline the show.  If confirmed, the band would join Bruce Springsteen and Coldplay at the Dublin stadium in 2024.  https://t.co/g8GGAoGkfK";0;0;1;14;en;18760904;1724475934210670991;LovinDublin;https://twitter.com/LovinDublin/status/1724475934210670991
Tue Nov 14 17:01:52 +0000 2023;1724472729615913367;"In all seriousness, I do hope Coldplay is having a wonderful time in Indonesia. Either with the culture or the people, so that Indonesia will always be a home for them ❤  Good luck for today's concert at Gelora Bung Karno stadium @coldplay. Break a leg! #ColdplayJakarta";0;0;0;2;en;923146919609696258;1724472729615913367;perfectcoldplay;https://twitter.com/perfectcoldplay/status/1724472729615913367
Tue Nov 14 17:00:00 +0000 2023;1724472260914737466;"MRT Jakarta's operating hours on the day of the Coldplay concert at Gelora Bung Karno Stadium, Jakarta, on Wednesday (11/15) will be extended until 1.30 a.m.  #SEAToday #SEATodayNews #Indonesia #Jakarta #MRTJakarta #Coldplay #MusicOfTheSpheresWorldTour https://t.co/Bq2EKBBZSv";0;0;1;4;en;1314830750533865472;1724472260914737466;seatodaynews;https://twitter.com/seatodaynews/status/1724472260914737466
Tue Nov 14 16:40:26 +0000 2023;1724467334109409484;"@iamjoelee @eaqlhmz Security guard Coldplay concert: https://t.co/jbvhwxmbi6";0;1;1;31;en;387715101;1724292109971165277;nickisanalien;https://twitter.com/nickisanalien/status/1724467334109409484
Tue Nov 14 16:37:19 +0000 2023;1724466551808798823;"One of the best and first watching concert is Coldplay Paris 2012 Mylo Xyloto Tour, and tomorrow Coldplay is getting concert in Gelora Bung Karno, Jakarta. Have a nice day in Jakarta. c, w, g, j! 🥹";0;0;0;0;en;3138904820;1724466549808038278;Aldifauzaaan;https://twitter.com/Aldifauzaaan/status/1724466551808798823
Tue Nov 14 16:37:13 +0000 2023;1724466526462349349;"concerts i’ve been to this year  harry styles x2 sam fender coldplay inhaler louis tomlinson x3";1;0;0;1;en;1150502719259648000;1724466526462349349;onlouuthebrave;https://twitter.com/onlouuthebrave/status/1724466526462349349
Tue Nov 14 16:34:37 +0000 2023;1724465870552867182;"@Nbello_ It's apparently real enough to trigger you out of going to a Coldplay concert 🤭";0;1;0;0;en;1404728557927079938;1724428507038494975;reallhere;https://twitter.com/reallhere/status/1724465870552867182
Tue Nov 14 16:31:03 +0000 2023;1724464973349556696;"@coldplay P welcome to JAKARTA city of the winner , enjoy guys , don't forget to Banda Neira if you finish from the concert .";0;0;0;3;en;93022544;1724405845272756328;tukanguduk69;https://twitter.com/tukanguduk69/status/1724464973349556696
Tue Nov 14 16:29:17 +0000 2023;1724464527557988752;"really sad rn bcs pupus bucket list aku nonton coldplay concert hufttt 😥😭";0;0;0;0;en;1693607816588906496;1724464527557988752;illbeurgolddd;https://twitter.com/illbeurgolddd/status/1724464527557988752
Tue Nov 14 16:24:33 +0000 2023;1724463338292420622;"Selling my ticket for Coldplay concert in January for only 33K";0;1;0;0;en;237649388;1724463338292420622;kharlmykharl;https://twitter.com/kharlmykharl/status/1724463338292420622
Tue Nov 14 16:24:25 +0000 2023;1724463304712613893;"Spreen is an Argentinian content creator who met Jin at the coldplay concert and fell in love with The Astronaut. Let’s vote for him! I just cast my VOTE for SPREEN. Who will you vote for? #TheGameAwards @TheGameAwards https://t.co/k1PbHha306";0;0;0;3;en;1690781968210759682;1724463304712613893;soultannie;https://twitter.com/soultannie/status/1724463304712613893
Tue Nov 14 16:20:47 +0000 2023;1724462391918784963;"Attending a Coldplay concert here 🕯️🕯️🕯️";0;0;0;1;en;1197790770612359168;1724462391918784963;but_zena;https://twitter.com/but_zena/status/1724462391918784963
Tue Nov 14 16:16:27 +0000 2023;1724461299034452033;"idk what should i do w my life anymore, i have coldplay concert tmr but oor mfs im 🥹❤️💔";0;0;0;1;en;4254649519;1724461299034452033;cootie1DfanAF;https://twitter.com/cootie1DfanAF/status/1724461299034452033
Tue Nov 14 16:00:02 +0000 2023;1724457167418544246;"man, i wish i could attend a coldplay concert just to hear them perform the whole of 'parachutes'";0;0;0;0;en;1019303171414470658;1724457167418544246;inalelub_;https://twitter.com/inalelub_/status/1724457167418544246
Tue Nov 14 16:00:01 +0000 2023;1724457166172807199;"Minister of Tourism and Creative Economy Sandiaga Uno said that Coldplay's concert on November 15 2023 would still be held, despite some rejections.   #SEAToday #SEATodayNews #Jakarta #Indonesia #Coldplay #MusicofTheSpheresWorldTour https://t.co/rAbu4VWUMI";0;0;0;1;en;1314830750533865472;1724457166172807199;seatodaynews;https://twitter.com/seatodaynews/status/1724457166172807199
Tue Nov 14 15:43:53 +0000 2023;1724453103133720992;"@khyt18 You can join Coldplay Malaysia telegram. There fans discuss all sorts of stuffs regarding the concert. Link should be on their X platform";0;0;0;0;en;50901414;1724446851645247877;nur_yazmin;https://twitter.com/nur_yazmin/status/1724453103133720992
Tue Nov 14 15:43:04 +0000 2023;1724452897419591816;"Got concert tickets for Ed Sheeran, Coldplay and Taylor Swift next year. Pretty stoked icl";0;1;0;0;en;463856756;1724452897419591816;BradenMunsamy;https://twitter.com/BradenMunsamy/status/1724452897419591816
Tue Nov 14 15:38:36 +0000 2023;1724451775909089356;"GUYS !! This morning, my friend that live in Taiwan sent me this video of Coldplay singing my universe in their concert !! Temenku tau kalo aku army, dan dia ngirimin ini pagi pagi tadi !! Aaaaaaaaaa gomawo chinguyaaaa 💜😭  All credits to my friend. Do not allow to claim it https://t.co/TgukDKLL50";0;2;0;1;en;1624979340797841410;1724451775909089356;moonjinbykairaa;https://twitter.com/moonjinbykairaa/status/1724451775909089356
Tue Nov 14 15:30:40 +0000 2023;1724449779500101858;"This boycott against Coldplay's concert is so funny because they're heterosexual as fuck.";0;0;0;1;en;140732977;1724449779500101858;aggidilimanto;https://twitter.com/aggidilimanto/status/1724449779500101858
Tue Nov 14 15:19:23 +0000 2023;1724446938043466127;"me as a baby army hopping on a flight to los angeles for the first time with $10 to my name and my mom's credit card to stay for an entire week and see the tannies for 3/4 shows while also seeing megan thee stallion and coldplay... my last ot7 concert too 😭😭😭☹️ https://t.co/Z6TRwqALv2";0;0;0;0;en;1563265691905511426;1724446204115779807;jikooksexygf;https://twitter.com/jikooksexygf/status/1724446938043466127
Tue Nov 14 15:18:14 +0000 2023;1724446648900915554;"It was a good choice not to attend Coldplay concert since I just know 10 of their songs list, and not even one song I remember a whole lyric😭  (I’m a type of person who attend concert to sing live with the singer)";0;0;0;0;en;53580483;1724446648900915554;Rinaaach;https://twitter.com/Rinaaach/status/1724446648900915554
Tue Nov 14 15:08:20 +0000 2023;1724444156297163080;"@annaleemedia @coldplay 🫶 most beautiful concert picture I have ever seen.... there is so much love in it.... ❤️";0;0;0;1;en;1545404243603066880;1724428130377412951;esOehlchen;https://twitter.com/esOehlchen/status/1724444156297163080
